{
  "dataset_version": "commerce-demo-2026.09.1",
  "updated_at": "2026-08-26T00:00:00Z",
  "categories": [
    {
      "category_id": "PHONE",
      "dataset_version": "commerce-demo-2026.09.1",
      "updated_at": "2026-08-26T00:00:00Z",
      "schema_version": "phone-1.0",
      "name": "手机",
      "attributes": ["ramGb", "storageGb", "batteryMah", "color"]
    },
    {
      "category_id": "MONITOR",
      "dataset_version": "commerce-demo-2026.09.1",
      "updated_at": "2026-08-26T00:00:00Z",
      "schema_version": "monitor-1.0",
      "name": "显示器",
      "attributes": [
        "sizeInch",
        "resolution",
        "refreshHz",
        "panelType",
        "pixelDensityPpi",
        "colorGamutSrgb",
        "colorAccuracyDeltaE",
        "brightnessNit",
        "eyeCareCertification",
        "usbCChargingW",
        "standAdjustable"
      ]
    }
  ],
  "products": [
    {
      "product_id": "P-PIXEL-9A",
      "category_id": "PHONE",
      "brand": "Northstar",
      "model": "N9A",
      "dataset_version": "commerce-demo-2026.09.1",
      "updated_at": "2026-08-26T00:00:00Z"
    },
    {
      "product_id": "P-LUMEN-14",
      "category_id": "PHONE",
      "brand": "Lumen",
      "model": "L14",
      "dataset_version": "commerce-demo-2026.09.1",
      "updated_at": "2026-08-26T00:00:00Z"
    },
    {
      "product_id": "P-ORBIT-X5",
      "category_id": "PHONE",
      "brand": "Orbit",
      "model": "X5",
      "dataset_version": "commerce-demo-2026.09.1",
      "updated_at": "2026-08-26T00:00:00Z"
    },
    {
      "product_id": "P-ASTER-3",
      "category_id": "PHONE",
      "brand": "Aster",
      "model": "A3",
      "dataset_version": "commerce-demo-2026.09.1",
      "updated_at": "2026-08-26T00:00:00Z"
    },
    {
      "product_id": "P-CEDAR-S",
      "category_id": "PHONE",
      "brand": "Cedar",
      "model": "S1",
      "dataset_version": "commerce-demo-2026.09.1",
      "updated_at": "2026-08-26T00:00:00Z"
    },
    {
      "product_id": "P-VALE-8",
      "category_id": "PHONE",
      "brand": "Vale",
      "model": "V8",
      "dataset_version": "commerce-demo-2026.09.1",
      "updated_at": "2026-08-26T00:00:00Z"
    },
    {
      "product_id": "P-CODEVIEW-27",
      "category_id": "MONITOR",
      "brand": "CodeView",
      "model": "C27U",
      "dataset_version": "commerce-demo-2026.09.1",
      "updated_at": "2026-08-26T00:00:00Z"
    },
    {
      "product_id": "P-COLORPRO-27",
      "category_id": "MONITOR",
      "brand": "ColorPro",
      "model": "P27Q",
      "dataset_version": "commerce-demo-2026.09.1",
      "updated_at": "2026-08-26T00:00:00Z"
    }
  ],
  "skus": [
    {
      "sku_id": "S-PIXEL-9A-128-B",
      "product_id": "P-PIXEL-9A",
      "dataset_version": "commerce-demo-2026.09.1",
      "updated_at": "2026-08-26T00:00:00Z",
      "attributes": {
        "ramGb": 8,
        "storageGb": 128,
        "batteryMah": 5100,
        "color": "black"
      }
    },
    {
      "sku_id": "S-PIXEL-9A-256-W",
      "product_id": "P-PIXEL-9A",
      "dataset_version": "commerce-demo-2026.09.1",
      "updated_at": "2026-08-26T00:00:00Z",
      "attributes": {
        "ramGb": 8,
        "storageGb": 256,
        "batteryMah": 5100,
        "color": "white"
      }
    },
    {
      "sku_id": "S-LUMEN-14-128-G",
      "product_id": "P-LUMEN-14",
      "dataset_version": "commerce-demo-2026.09.1",
      "updated_at": "2026-08-26T00:00:00Z",
      "attributes": {
        "ramGb": 12,
        "storageGb": 128,
        "batteryMah": 4800,
        "color": "green"
      }
    },
    {
      "sku_id": "S-LUMEN-14-256-B",
      "product_id": "P-LUMEN-14",
      "dataset_version": "commerce-demo-2026.09.1",
      "updated_at": "2026-08-26T00:00:00Z",
      "attributes": {
        "ramGb": 12,
        "storageGb": 256,
        "batteryMah": 4800,
        "color": "black"
      }
    },
    {
      "sku_id": "S-ORBIT-X5-256-B",
      "product_id": "P-ORBIT-X5",
      "dataset_version": "commerce-demo-2026.09.1",
      "updated_at": "2026-08-26T00:00:00Z",
      "attributes": {
        "ramGb": 12,
        "storageGb": 256,
        "batteryMah": 5300,
        "color": "black"
      }
    },
    {
      "sku_id": "S-ORBIT-X5-512-S",
      "product_id": "P-ORBIT-X5",
      "dataset_version": "commerce-demo-2026.09.1",
      "updated_at": "2026-08-26T00:00:00Z",
      "attributes": {
        "ramGb": 16,
        "storageGb": 512,
        "batteryMah": 5300,
        "color": "silver"
      }
    },
    {
      "sku_id": "S-ASTER-3-128-B",
      "product_id": "P-ASTER-3",
      "dataset_version": "commerce-demo-2026.09.1",
      "updated_at": "2026-08-26T00:00:00Z",
      "attributes": {
        "ramGb": 8,
        "storageGb": 128,
        "batteryMah": 5000,
        "color": "black"
      }
    },
    {
      "sku_id": "S-ASTER-3-256-P",
      "product_id": "P-ASTER-3",
      "dataset_version": "commerce-demo-2026.09.1",
      "updated_at": "2026-08-26T00:00:00Z",
      "attributes": {
        "ramGb": 12,
        "storageGb": 256,
        "batteryMah": 5000,
        "color": "purple"
      }
    },
    {
      "sku_id": "S-CEDAR-S-128-W",
      "product_id": "P-CEDAR-S",
      "dataset_version": "commerce-demo-2026.09.1",
      "updated_at": "2026-08-26T00:00:00Z",
      "attributes": {
        "ramGb": 8,
        "storageGb": 128,
        "batteryMah": 5500,
        "color": "white"
      }
    },
    {
      "sku_id": "S-CEDAR-S-256-B",
      "product_id": "P-CEDAR-S",
      "dataset_version": "commerce-demo-2026.09.1",
      "updated_at": "2026-08-26T00:00:00Z",
      "attributes": {
        "ramGb": 12,
        "storageGb": 256,
        "batteryMah": 5500,
        "color": "black"
      }
    },
    {
      "sku_id": "S-VALE-8-128-B",
      "product_id": "P-VALE-8",
      "dataset_version": "commerce-demo-2026.09.1",
      "updated_at": "2026-08-26T00:00:00Z",
      "attributes": {
        "ramGb": 8,
        "storageGb": 128,
        "batteryMah": 4600,
        "color": "black"
      }
    },
    {
      "sku_id": "S-VALE-8-256-B",
      "product_id": "P-VALE-8",
      "dataset_version": "commerce-demo-2026.09.1",
      "updated_at": "2026-08-26T00:00:00Z",
      "attributes": {
        "ramGb": 12,
        "storageGb": 256,
        "batteryMah": 4600,
        "color": "blue"
      }
    },
    {
      "sku_id": "S-CODEVIEW-27-BASE",
      "product_id": "P-CODEVIEW-27",
      "dataset_version": "commerce-demo-2026.09.1",
      "updated_at": "2026-08-26T00:00:00Z",
      "attributes": {
        "sizeInch": 27,
        "resolution": "4K",
        "refreshHz": 60,
        "panelType": "IPS",
        "pixelDensityPpi": 163,
        "colorGamutSrgb": 100,
        "colorAccuracyDeltaE": 1.8,
        "brightnessNit": 350,
        "eyeCareCertification": true,
        "usbCChargingW": 65,
        "standAdjustable": false
      }
    },
    {
      "sku_id": "S-CODEVIEW-27-ERGONOMIC",
      "product_id": "P-CODEVIEW-27",
      "dataset_version": "commerce-demo-2026.09.1",
      "updated_at": "2026-08-26T00:00:00Z",
      "attributes": {
        "sizeInch": 27,
        "resolution": "4K",
        "refreshHz": 60,
        "panelType": "IPS",
        "pixelDensityPpi": 163,
        "colorGamutSrgb": 100,
        "colorAccuracyDeltaE": 1.8,
        "brightnessNit": 350,
        "eyeCareCertification": true,
        "usbCChargingW": 90,
        "standAdjustable": true
      }
    },
    {
      "sku_id": "S-COLORPRO-27-BASE",
      "product_id": "P-COLORPRO-27",
      "dataset_version": "commerce-demo-2026.09.1",
      "updated_at": "2026-08-26T00:00:00Z",
      "attributes": {
        "sizeInch": 27,
        "resolution": "2K",
        "refreshHz": 165,
        "panelType": "IPS",
        "pixelDensityPpi": 109,
        "colorGamutSrgb": 100,
        "colorAccuracyDeltaE": 1.5,
        "brightnessNit": 400,
        "eyeCareCertification": true,
        "usbCChargingW": 0,
        "standAdjustable": false
      }
    },
    {
      "sku_id": "S-COLORPRO-27-STAND",
      "product_id": "P-COLORPRO-27",
      "dataset_version": "commerce-demo-2026.09.1",
      "updated_at": "2026-08-26T00:00:00Z",
      "attributes": {
        "sizeInch": 27,
        "resolution": "2K",
        "refreshHz": 165,
        "panelType": "IPS",
        "pixelDensityPpi": 109,
        "colorGamutSrgb": 100,
        "colorAccuracyDeltaE": 1.5,
        "brightnessNit": 400,
        "eyeCareCertification": true,
        "usbCChargingW": 0,
        "standAdjustable": true
      }
    }
  ],
  "shops": [
    {
      "shop_id": "SHOP-DIRECT",
      "name": "品牌直营店",
      "dataset_version": "commerce-demo-2026.09.1",
      "updated_at": "2026-08-26T00:00:00Z"
    },
    {
      "shop_id": "SHOP-CARE",
      "name": "安心数码店",
      "dataset_version": "commerce-demo-2026.09.1",
      "updated_at": "2026-08-26T00:00:00Z"
    }
  ],
  "offers": [
    {
      "offer_id": "O-PIXEL-128",
      "sku_id": "S-PIXEL-9A-128-B",
      "shop_id": "SHOP-DIRECT",
      "list_price": "3199.00",
      "price": "2999.00",
      "additional_fee": "0.00",
      "currency": "CNY",
      "stock_status": "IN_STOCK",
      "valid_from": "2026-08-01T00:00:00Z",
      "valid_to": "2026-09-01T00:00:00Z",
      "version": 0,
      "dataset_version": "commerce-demo-2026.09.1",
      "updated_at": "2026-08-26T00:00:00Z"
    },
    {
      "offer_id": "O-PIXEL-256",
      "sku_id": "S-PIXEL-9A-256-W",
      "shop_id": "SHOP-DIRECT",
      "list_price": "3499.00",
      "price": "3299.00",
      "additional_fee": "0.00",
      "currency": "CNY",
      "stock_status": "IN_STOCK",
      "valid_from": "2026-08-01T00:00:00Z",
      "valid_to": "2026-09-01T00:00:00Z",
      "version": 0,
      "dataset_version": "commerce-demo-2026.09.1",
      "updated_at": "2026-08-26T00:00:00Z"
    },
    {
      "offer_id": "O-LUMEN-128",
      "sku_id": "S-LUMEN-14-128-G",
      "shop_id": "SHOP-CARE",
      "list_price": "2899.00",